[
  {
    "schema_id": "emergentism/ProblemAdjudication.v1",
    "problem_id": "PQA54@0.1:MET:GROUND",
    "canonical_problem_id": "PQA54@0.1:MET:GROUND",
    "aliases": [],
    "domain": "MET",
    "family": "ground",
    "native_problem": "Ground, sufficient reason and explanatory termination.",
    "native_reference": "Leibniz, Principles of Nature and Grace §7; Heidegger, Introduction to Metaphysics.",
    "proposed_answer": "Emergentism places a GROUND_BOUNDARY where object-language explanation no longer has a lawful target; it does not turn Ground into an object or necessary being.",
    "proposed_effect": "REFRAME",
    "earned_effect": "NO_INCREMENT",
    "result_state": "SELECTED",
    "assumptions": [
      "the native problem and premises are preserved",
      "the proposal has not been independently reviewed"
    ],
    "strongest_rival": "The native ground, sufficient reason and explanatory termination. literature plus generic decomposition explains the issue more faithfully and with less imposed vocabulary.",
    "native_frame_control": "Answer only within the native frame anchored by Leibniz, Principles of Nature and Grace §7; Heidegger, Introduction to Metaphysics.",
    "generic_decomposition_control": "Separate terms, levels, carriers, warrants and residuals without using Emergentist vocabulary.",
    "discriminator": "Two blinded native-domain reviewers must find incremental clarification or resolution beyond both controls while every premise and residual remains visible.",
    "kill_criterion": "No result is earned if the question changes, a premise or residual disappears, the native account is distorted, review quorum is absent or the proposal adds no value over both controls.",
    "remaining_debt": "Why that boundary rather than a brute fact or necessary truth remains open.",
    "survivor_if_killed": "The native problem, references, public denominator and explicit debt remain.",
    "linked_drop_ids": [
      "TC-AMR-001",
      "TC-HAL-002"
    ],
    "native_reviews": []
  },
  {
    "schema_id": "emergentism/ProblemAdjudication.v1",
    "problem_id": "PQA54@0.1:MET:ONE_MANY",
    "canonical_problem_id": "PQA54@0.1:MET:ONE_MANY",
    "aliases": [
      "LEGACY:PD-05"
    ],
    "domain": "MET",
    "family": "one_and_many",
    "native_problem": "Unity, plurality and dependence without erasure.",
    "native_reference": "Plato, Parmenides; Aristotle, Metaphysics.",
    "proposed_answer": "Typed levels allow one coherent whole and genuine plural situated bearers without identifying either with the other.",
    "proposed_effect": "CLARIFICATION",
    "earned_effect": "NO_INCREMENT",
    "result_state": "SELECTED",
    "assumptions": [
      "the native problem and premises are preserved",
      "the proposal has not been independently reviewed"
    ],
    "strongest_rival": "The native unity, plurality and dependence without erasure. literature plus generic decomposition explains the issue more faithfully and with less imposed vocabulary.",
    "native_frame_control": "Answer only within the native frame anchored by Plato, Parmenides; Aristotle, Metaphysics.",
    "generic_decomposition_control": "Separate terms, levels, carriers, warrants and residuals without using Emergentist vocabulary.",
    "discriminator": "Two blinded native-domain reviewers must find incremental clarification or resolution beyond both controls while every premise and residual remains visible.",
    "kill_criterion": "No result is earned if the question changes, a premise or residual disappears, the native account is distorted, review quorum is absent or the proposal adds no value over both controls.",
    "remaining_debt": "The metaphysical dependence relation is not thereby proved.",
    "survivor_if_killed": "The native problem, references, public denominator and explicit debt remain.",
    "linked_drop_ids": [
      "TC-AMR-001",
      "TC-HAL-002"
    ],
    "native_reviews": []
  },
  {
    "schema_id": "emergentism/ProblemAdjudication.v1",
    "problem_id": "PQA54@0.1:MET:UNIVERSALS",
    "canonical_problem_id": "PQA54@0.1:MET:UNIVERSALS",
    "aliases": [],
    "domain": "MET",
    "family": "universals_particulars",
    "native_problem": "Realism, nominalism and trope theories of universals.",
    "native_reference": "Plato, Republic; Aristotle, Categories and Metaphysics.",
    "proposed_answer": "Repeatable properties may be tracked as invariants across transformations while their nominalist, realist or trope ontology remains open.",
    "proposed_effect": "CLARIFICATION",
    "earned_effect": "NO_INCREMENT",
    "result_state": "SELECTED",
    "assumptions": [
      "the native problem and premises are preserved",
      "the proposal has not been independently reviewed"
    ],
    "strongest_rival": "The native realism, nominalism and trope theories of universals. literature plus generic decomposition explains the issue more faithfully and with less imposed vocabulary.",
    "native_frame_control": "Answer only within the native frame anchored by Plato, Republic; Aristotle, Categories and Metaphysics.",
    "generic_decomposition_control": "Separate terms, levels, carriers, warrants and residuals without using Emergentist vocabulary.",
    "discriminator": "Two blinded native-domain reviewers must find incremental clarification or resolution beyond both controls while every premise and residual remains visible.",
    "kill_criterion": "No result is earned if the question changes, a premise or residual disappears, the native account is distorted, review quorum is absent or the proposal adds no value over both controls.",
    "remaining_debt": "What makes an invariant ontologically real remains disputed.",
    "survivor_if_killed": "The native problem, references, public denominator and explicit debt remain.",
    "linked_drop_ids": [
      "TC-AMR-001",
      "TC-HAL-002"
    ],
    "native_reviews": []
  },
  {
    "schema_id": "emergentism/ProblemAdjudication.v1",
    "problem_id": "PQA54@0.1:MET:IDENTITY",
    "canonical_problem_id": "PQA54@0.1:MET:IDENTITY",
    "aliases": [
      "LEGACY:PD-06"
    ],
    "domain": "MET",
    "family": "identity_persistence",
    "native_problem": "Numerical identity, continuity, constitution and persistence.",
    "native_reference": "Locke, Essay Concerning Human Understanding II.27; Parfit, Reasons and Persons.",
    "proposed_answer": "Identity claims must declare which continuity—material, causal, structural, functional, narrative or authorized—carries the same bearer.",
    "proposed_effect": "CLARIFICATION",
    "earned_effect": "NO_INCREMENT",
    "result_state": "SELECTED",
    "assumptions": [
      "the native problem and premises are preserved",
      "the proposal has not been independently reviewed"
    ],
    "strongest_rival": "The native numerical identity, continuity, constitution and persistence. literature plus generic decomposition explains the issue more faithfully and with less imposed vocabulary.",
    "native_frame_control": "Answer only within the native frame anchored by Locke, Essay Concerning Human Understanding II.27; Parfit, Reasons and Persons.",
    "generic_decomposition_control": "Separate terms, levels, carriers, warrants and residuals without using Emergentist vocabulary.",
    "discriminator": "Two blinded native-domain reviewers must find incremental clarification or resolution beyond both controls while every premise and residual remains visible.",
    "kill_criterion": "No result is earned if the question changes, a premise or residual disappears, the native account is distorted, review quorum is absent or the proposal adds no value over both controls.",
    "remaining_debt": "No universal criterion of persistence follows.",
    "survivor_if_killed": "The native problem, references, public denominator and explicit debt remain.",
    "linked_drop_ids": [
      "TC-AMR-001",
      "TC-HAL-002"
    ],
    "native_reviews": []
  },
  {
    "schema_id": "emergentism/ProblemAdjudication.v1",
    "problem_id": "PQA54@0.1:MET:MODALITY",
    "canonical_problem_id": "PQA54@0.1:MET:MODALITY",
    "aliases": [],
    "domain": "MET",
    "family": "modality_possible_worlds",
    "native_problem": "Modal truth, accessibility and possible-world semantics.",
    "native_reference": "Kripke, Naming and Necessity; Lewis, On the Plurality of Worlds.",
    "proposed_answer": "Possible content, actual carriers and actual histories are distinct types; this blocks actuality inflation without choosing modal realism.",
    "proposed_effect": "CLARIFICATION",
    "earned_effect": "NO_INCREMENT",
    "result_state": "SELECTED",
    "assumptions": [
      "the native problem and premises are preserved",
      "the proposal has not been independently reviewed"
    ],
    "strongest_rival": "The native modal truth, accessibility and possible-world semantics. literature plus generic decomposition explains the issue more faithfully and with less imposed vocabulary.",
    "native_frame_control": "Answer only within the native frame anchored by Kripke, Naming and Necessity; Lewis, On the Plurality of Worlds.",
    "generic_decomposition_control": "Separate terms, levels, carriers, warrants and residuals without using Emergentist vocabulary.",
    "discriminator": "Two blinded native-domain reviewers must find incremental clarification or resolution beyond both controls while every premise and residual remains visible.",
    "kill_criterion": "No result is earned if the question changes, a premise or residual disappears, the native account is distorted, review quorum is absent or the proposal adds no value over both controls.",
    "remaining_debt": "Truthmakers for modal claims remain open.",
    "survivor_if_killed": "The native problem, references, public denominator and explicit debt remain.",
    "linked_drop_ids": [
      "TC-AMR-001",
      "TC-HAL-002"
    ],
    "native_reviews": []
  },
  {
    "schema_id": "emergentism/ProblemAdjudication.v1",